Symbol,Name,Last Sale,Net Change,% Change,Market Cap,Country,IPO Year,Volume,Sector,Industry
DEO,Diageo plc Common Stock,$135.77,1.24,0.922%,75525113116.00,United Kingdom,,581911,Consumer Staples,Beverages (Production/Distribution)
DERM,Journey Medical Corporation Common Stock,$6.28,0.52,9.028%,130167048.00,United States,2021,62043,Health Care,Biotechnology: Pharmaceutical Preparations
DESP,Despegar.com Corp. Ordinary Shares,$13.20,0.38,2.964%,951115559.00,Argentina,2017,755936,Consumer Discretionary,Transportation Services
DFH,Dream Finders Homes Inc. Class A Common Stock,$33.93,0.72,2.168%,3180195892.00,United States,2022,249413,Consumer Discretionary,Homebuilding
DFIN,Donnelley Financial Solutions Inc. Common Stock ,$66.34,0.34,0.515%,1926080997.00,United States,2016,395218,Consumer Discretionary,Other Consumer Services
DFLI,Dragonfly Energy Holdings Corp. Common Stock (NV),$0.622,0.0632,11.31%,38931708.00,United States,2021,413760,Miscellaneous,Industrial Machinery/Components
DFLIW,Dragonfly Energy Holdings Corp. Warrant,$0.026,-0.0025,-8.772%,1627370.00,United States,2021,15745,Miscellaneous,Industrial Machinery/Components
DFP,Flaherty & Crumrine Dynamic Preferred and Income Fund Inc. Common Stock,$21.17,0.05,0.237%,0.00,,2013,35275,Finance,Investment Managers
DFS,Discover Financial Services Common Stock,$147.53,0.39,0.265%,37040584296.00,United States,,1191640,Finance,Finance: Consumer Services
DG,Dollar General Corporation Common Stock,$82.23,1.66,2.06%,18083625580.00,United States,2009,4793631,Consumer Discretionary,Department/Specialty Retail Stores
DGHI,Digihost Technology Inc. Common Subordinate Voting Shares,$1.2605,0.1905,17.804%,41583895.00,Canada,,210325,Finance,Finance: Consumer Services
DGICA,Donegal Group Inc. Class A Common Stock,$14.92,0.24,1.635%,499576058.00,United States,,41577,Finance,Property-Casualty Insurers
DGICB,Donegal Group Inc. Class B Common Stock,$13.86,0.98,7.609%,464083389.00,United States,1986,278,Finance,Property-Casualty Insurers
DGII,Digi International Inc. Common Stock,$30.56,0.89,3.00%,1112848023.00,United States,1989,109668,Telecommunications,Computer Communications Equipment
DGLY,Digital Ally Inc. Common Stock,$1.055,0.015,1.442%,4067194.00,United States,,32845,Technology,Radio And Television Broadcasting And Communications Equipment
DGX,Quest Diagnostics Incorporated Common Stock,$148.93,-0.42,-0.281%,16578471787.00,United States,,524441,Health Care,Medical Specialities
DH,Definitive Healthcare Corp. Class A Common Stock,$4.54,0.11,2.483%,531738928.00,United States,2021,267357,Technology,Computer Software: Prepackaged Software
DHAI,DIH Holdings US Inc. Class A Common Stock,$1.78,-0.02,-1.111%,72169984.00,United States,2024,72170,Health Care,Medical/Dental Instruments
DHAIW,DIH Holding US Inc. Warrants,$0.029,-0.003,-9.375%,1175803.00,United States,2024,556,Health Care,Medical/Dental Instruments
DHC,Diversified Healthcare Trust Common Shares of Beneficial Interest,$3.79,0.22,6.162%,911777776.00,United States,,694473,Real Estate,Real Estate Investment Trusts
DHCNI,Diversified Healthcare Trust 5.625% Senior Notes due 2042,$16.74,0.05,0.30%,4027218988.00,United States,,48732,Real Estate,Real Estate Investment Trusts
DHCNL,Diversified Healthcare Trust 6.25% Senior Notes Due 2046,$17.78,0.20,1.138%,4277416584.00,United States,,44677,Real Estate,Real Estate Investment Trusts
DHF,BNY Mellon High Yield Strategies Fund Common Stock,$2.60,0.01,0.386%,0.00,United States,1998,237871,Finance,Finance Companies
DHI,D.R. Horton Inc. Common Stock,$192.43,3.03,1.60%,62739895673.00,United States,,1447067,Consumer Discretionary,Homebuilding
DHIL,Diamond Hill Investment Group Inc. Class A Common Stock,$160.58,3.18,2.02%,441759273.00,United States,,8924,Finance,Investment Managers
DHR,Danaher Corporation Common Stock,$268.03,-4.65,-1.705%,193574772100.00,United States,,2820000,Industrials,Industrial Machinery/Components
DHT,DHT Holdings Inc.,$11.20,0.17,1.541%,1803194870.00,Jersey,2005,1168206,Consumer Discretionary,Marine Transportation
DHX,DHI Group Inc. Common Stock,$1.87,0.05,2.747%,90515226.00,United States,2007,31578,Consumer Discretionary,Business Services
DHY,Credit Suisse High Yield Bond Fund Common Stock,$2.21,-0.01,-0.45%,0.00,United States,1998,242449,Finance,Finance/Investors Services
DIAX,Nuveen Dow 30SM Dynamic Overwrite Fund Common Shares of Beneficial Interest,$15.17,0.11,0.73%,0.00,,2014,171222,Finance,Finance Companies
DIBS,1stdibs.com Inc. Common Stock,$4.66,0.12,2.643%,184970023.00,United States,2021,55766,Consumer Discretionary,Catalog/Specialty Distribution
DIN,Dine Brands Global Inc. Common Stock,$32.61,0.74,2.322%,498900879.00,United States,,404095,Consumer Discretionary,Restaurants
DINO,HF Sinclair Corporation Common Stock,$43.66,0.39,0.901%,8331057733.00,United States,1960,1519936,Energy,Natural Gas Distribution
DIOD,Diodes Incorporated Common Stock,$64.39,1.29,2.044%,2983290501.00,United States,,250478,Technology,Semiconductors
DIS,Walt Disney Company (The) Common Stock,$96.75,2.53,2.685%,175464579015.00,United States,,9925728,Consumer Discretionary,Services-Misc. Amusement & Recreation
DIST,Distoken Acquisition Corporation Ordinary Shares,$10.90,-0.0006,-0.006%,0.00,China,2023,801,Finance,Blank Checks
DIT,AMCON Distributing Company Common Stock,$137.30,4.79,3.615%,86548703.00,United States,1999,209,Consumer Discretionary,Food Distributors
DJCO,Daily Journal Corp. (S.C.) Common Stock,$499.20,17.20,3.568%,687611059.00,United States,,14672,Consumer Discretionary,Newspapers/Magazines
DJT,Trump Media & Technology Group Corp. Common Stock,$31.26,4.20,15.521%,6086815033.00,United States,2024,57074794,Technology,Computer Software: Programming Data Processing
DJTWW,Trump Media & Technology Group Corp. Warrants,$23.125,2.795,13.748%,4502802228.00,United States,2021,684714,Technology,Computer Software: Programming Data Processing
DK,Delek US Holdings Inc. Common Stock,$17.48,0.19,1.099%,1128135165.00,United States,2017,1544750,Energy,Integrated oil Companies
DKL,Delek Logistics Partners L.P. Common Units representing Limited Partner Interests,$39.21,0.07,0.179%,1851886379.00,United States,2012,96131,Energy,Natural Gas Distribution
DKNG,DraftKings Inc. Class A Common Stock,$37.20,-0.94,-2.465%,18061731066.00,United States,2019,6942303,Consumer Discretionary,Services-Misc. Amusement & Recreation
DKS,Dick's Sporting Goods Inc Common Stock,$212.66,3.01,1.436%,17313229673.00,United States,2002,723308,Consumer Discretionary,Other Specialty Stores
DLB,Dolby Laboratories Common Stock,$74.02,0.52,0.707%,7057631054.00,United States,2005,313356,Miscellaneous,Multi-Sector Companies
DLHC,DLH Holdings Corp.,$8.955,0.095,1.072%,127007789.00,United States,,58981,Consumer Discretionary,Professional Services
DLNG,Dynagas LNG Partners LP Common Units,$3.82,0.02,0.526%,140720293.00,Greece,,18868,Consumer Discretionary,Marine Transportation
DLNG^A,Dynagas LNG Partners LP 9.00% Series A Cumulative Redeemable Preferred Units,$25.6501,-0.1107,-0.43%,,Greece,,2634,,
DLNG^B,Dynagas LNG Partners LP 8.75% Series B Fixed to Floating Rate Cumulative Redeemable Perpetual Preferred Units liquidation preference $25.00 per Uni,$26.1401,-0.0199,-0.076%,,Greece,,1892,,
DLO,DLocal Limited Class A Common Shares,$9.27,0.38,4.274%,2743842735.00,Uruguay,2021,1341591,Consumer Discretionary,Business Services
DLPN,Dolphin Entertainment Inc. Common Stock,$1.45,-0.01,-0.685%,32213738.00,United States,,70365,Consumer Discretionary,Other Consumer Services
DLR,Digital Realty Trust Inc. Common Stock,$162.13,0.92,0.571%,53083152888.00,United States,2004,1307630,Real Estate,Real Estate Investment Trusts
DLR^J,Digital Realty Trust Inc. 5.250% Series J Cumulative Redeemable Preferred Stock,$24.51,0.08,0.327%,,United States,,13388,,
DLR^K,Digital Realty Trust Inc. 5.850% Series K Cumulative Redeemable Preferred Stock par value $0.01 per share,$25.05,0.04,0.16%,,United States,,9365,,
DLR^L,Digital Realty Trust Inc. 5.200% Series L Cumulative Redeemable Preferred Stock,$24.08,0.13,0.543%,,United States,,27996,,
DLTH,Duluth Holdings Inc. Class B Common Stock,$4.03,0.07,1.768%,141192666.00,United States,2015,29115,Consumer Discretionary,Clothing/Shoe/Accessory Stores
DLTR,Dollar Tree Inc. Common Stock,$68.02,0.29,0.428%,14623763934.00,United States,1995,2540944,Consumer Discretionary,Department/Specialty Retail Stores
DLX,Deluxe Corporation Common Stock,$19.69,0.21,1.078%,870517307.00,United States,,229979,Consumer Discretionary,Publishing
DLY,DoubleLine Yield Opportunities Fund Common Shares of Beneficial Interest,$16.425,-0.115,-0.695%,787509420.00,United States,2020,97909,Finance,Investment Managers
DM,Desktop Metal Inc. Class A Common Stock,$4.90,0.00,0.00%,162844669.00,United States,2019,155250,Technology,Industrial Machinery/Components
DMA,Destra Multi-Alternative Fund Common Stock,$8.84,0.09,1.029%,0.00,,2022,20309,Finance,Trusts Except Educational Religious and Charitable
DMAC,DiaMedica Therapeutics Inc. Common Stock,$4.40,-0.05,-1.124%,188090461.00,United States,2018,27283,Health Care,Biotechnology: Pharmaceutical Preparations
DMB,BNY Mellon Municipal Bond Infrastructure Fund Inc. Common Stock,$11.05,0.07,0.638%,0.00,,2013,34360,Finance,Trusts Except Educational Religious and Charitable
DMF,BNY Mellon Municipal Income Inc. Common Stock,$7.303,0.023,0.316%,454910107.00,United States,1988,28193,Finance,Finance/Investors Services
DMLP,Dorchester Minerals L.P. Common Units Representing Limited Partnership Interests,$32.09,0.03,0.094%,1286443559.00,United States,,50683,Energy,Oil & Gas Production
DMO,Western Asset Mortgage Opportunity Fund Inc. Common Stock,$12.2149,-0.0151,-0.123%,0.00,United States,2010,64099,Finance,Trusts Except Educational Religious and Charitable
DMRC,Digimarc Corporation Common Stock,$29.65,-0.03,-0.101%,635121531.00,United States,,67109,Technology,EDP Services
DNA,Ginkgo Bioworks Holdings Inc. Class A Common Stock,$8.27,0.48,6.162%,459608434.00,United States,2021,882323,Health Care,Biotechnology: Biological Products (No Diagnostic Substances)
DNB,Dun & Bradstreet Holdings Inc. Common Stock,$11.44,0.32,2.878%,5054033384.00,United States,2020,1887364,Finance,Finance: Consumer Services
DNLI,Denali Therapeutics Inc. Common Stock,$27.66,0.81,3.017%,3959951202.00,United States,2017,650981,Health Care,Biotechnology: Biological Products (No Diagnostic Substances)
DNMR,Danimer Scientific Inc. Common Stock,$0.409,0.0345,9.212%,49149575.00,United States,2020,438328,Industrials,Major Chemicals
DNN,Denison Mines Corp Ordinary Shares (Canada),$2.18,0.25,12.953%,1945366454.00,Canada,,54458995,Basic Materials,Other Metals and Minerals
DNOW,DNOW Inc. Common Stock,$12.47,-0.03,-0.24%,1327680838.00,United States,2014,633464,Industrials,Metal Fabrications
DNP,DNP Select Income Fund Inc. Common Stock,$9.77,0.09,0.93%,0.00,United States,1987,535875,Finance,Investment Managers
DNTH,Dianthus Therapeutics Inc. Common Stock,$27.97,0.43,1.561%,821040330.00,United States,2018,149172,Health Care,Biotechnology: Pharmaceutical Preparations
DNUT,Krispy Kreme Inc. Common Stock,$11.49,0.19,1.681%,1948704000.00,United States,2021,1321224,Consumer Staples,Food Chains
DOC,Healthpeak Properties Inc. Common Stock,$22.69,0.37,1.658%,15866922184.00,United States,,4387564,Real Estate,Real Estate Investment Trusts
DOCN,DigitalOcean Holdings Inc. Common Stock,$43.55,-0.45,-1.023%,4009315168.00,United States,2021,557261,Technology,Computer Software: Programming Data Processing
DOCS,Doximity Inc. Class A Common Stock,$44.41,0.55,1.254%,8245187246.00,United States,2021,1190482,Technology,EDP Services
DOCU,DocuSign Inc. Common Stock,$72.60,2.56,3.655%,14735818964.00,United States,1989,5092342,Technology,Computer Software: Prepackaged Software
DOGZ,Dogness (International) Corporation Class A Common Stock,$40.57,2.01,5.213%,430924925.00,China,2017,173238,Consumer Discretionary,Miscellaneous manufacturing industries
DOLE,Dole plc Ordinary Shares,$16.31,0.17,1.053%,1548294909.00,Ireland,2021,419883,Consumer Staples,Farming/Seeds/Milling
DOMH,Dominari Holdings Inc. Common Stock,$1.94,0.12,6.593%,12175708.00,United States,,32744,Health Care,Biotechnology: Pharmaceutical Preparations
DOMO,Domo Inc. Class B Common Stock,$7.47,0.065,0.878%,288572569.00,United States,2018,410119,Technology,Computer Software: Prepackaged Software
DOOO,BRP Inc. (Recreational Products) Common Subordinate Voting Shares,$57.06,0.59,1.045%,4165525902.00,Canada,,74876,Consumer Discretionary,Industrial Specialties
DORM,Dorman Products Inc. Common Stock,$117.75,0.85,0.727%,3599886794.00,United States,,147626,Consumer Discretionary,Auto Parts:O.E.M.
DOUG,Douglas Elliman Inc. Common Stock,$1.60,0.01,0.629%,146932186.00,United States,2021,346306,Finance,Real Estate
DOV,Dover Corporation Common Stock,$192.79,1.51,0.789%,26500454367.00,United States,,750266,Industrials,Industrial Machinery/Components
DOW,Dow Inc. Common Stock ,$52.94,0.37,0.704%,37106759222.00,United States,2019,4492419,Industrials,Major Chemicals
DOX,Amdocs Limited Ordinary Shares,$89.66,0.93,1.048%,10521405452.00,Guernsey,,326544,Technology,EDP Services
DOYU,DouYu International Holdings Limited ADS,$8.98,0.06,0.673%,284087455.00,China,2019,98860,Technology,Computer Software: Programming Data Processing
DPCS,DP Cap Acquisition Corp I Class A Ordinary Shares,$11.47,-0.06,-0.52%,0.00,United States,2021,1200,Finance,Blank Checks
DPCSW,DP Cap Acquisition Corp I Warrants,$0.0149,-0.0001,-0.667%,0.00,United States,2021,110,Finance,Blank Checks
DPG,Duff & Phelps Utility and Infrastructure Fund Inc.,$11.81,0.07,0.596%,0.00,United States,2011,83745,Finance,Trusts Except Educational Religious and Charitable
DPRO,Draganfly Inc. Common Shares,$2.87,-0.31,-9.748%,10006708.00,Canada,,146944,Industrials,Aerospace
DPZ,Domino's Pizza Inc Common Stock,$428.36,1.10,0.257%,14792118096.00,United States,2004,502219,Consumer Discretionary,Food Distributors
DQ,DAQO New Energy Corp. American Depositary Shares each representing five ordinary shares,$18.90,0.34,1.832%,1247540824.00,China,2010,486988,Technology,Semiconductors
DRCT,Direct Digital Holdings Inc. Class A Common Stock,$2.77,-0.82,-22.841%,39529077.00,United States,2022,871251,Consumer Discretionary,Advertising
DRD,DRDGOLD Limited American Depositary Shares,$10.75,0.39,3.764%,929432863.00,South Africa,,299047,Basic Materials,Precious Metals
DRH,Diamondrock Hospitality Company Common Stock,$9.10,0.20,2.247%,1886044251.00,United States,2005,1181191,Real Estate,Real Estate Investment Trusts
DRH^A,Diamondrock Hospitality Company 8.250% Series A Cumulative Redeemable Preferred Stock,$25.86,0.14,0.544%,,United States,,14801,,
DRI,Darden Restaurants Inc. Common Stock,$162.93,2.79,1.742%,19144352555.00,United States,,1127393,Consumer Discretionary,Restaurants
DRIO,DarioHealth Corp. Common Stock,$1.0169,0.0169,1.69%,30535758.00,Israel,,41169,Health Care,Medical/Dental Instruments
DRMA,Dermata Therapeutics Inc. Common Stock,$1.33,0.04,3.101%,1750255.00,United States,2021,275394,Health Care,Biotechnology: Pharmaceutical Preparations
DRMAW,Dermata Therapeutics Inc. Warrant,$0.0084,0.00,0.00%,11054.00,United States,2021,10,Health Care,Biotechnology: Pharmaceutical Preparations
DRRX,DURECT Corporation Common Stock,$1.29,-0.01,-0.769%,40040801.00,United States,2000,65021,Health Care,Biotechnology: Pharmaceutical Preparations
DRS,Leonardo DRS Inc. Common Stock,$28.81,0.59,2.091%,7597277870.00,Israel,,444743,Industrials,Industrial Machinery/Components
DRTS,Alpha Tau Medical Ltd. Ordinary Shares,$2.28,0.10,4.587%,158848995.00,Israel,,2217,Health Care,Medical/Dental Instruments
DRTSW,Alpha Tau Medical Ltd. Warrant,$0.1782,0.018,11.236%,12415303.00,Israel,,840,Health Care,Medical/Dental Instruments
DRUG,Bright Minds Biosciences Inc. Common Stock,$28.80,-9.69,-25.175%,128558506.00,Canada,,13517637,Health Care,Biotechnology: Pharmaceutical Preparations
DRVN,Driven Brands Holdings Inc. Common Stock,$14.73,0.24,1.656%,2416926063.00,United States,2021,520710,Consumer Discretionary,Automotive Aftermarket
DSGN,Design Therapeutics Inc. Common Stock,$5.65,0.26,4.824%,319905966.00,United States,2021,123488,Health Care,Biotechnology: Pharmaceutical Preparations
DSGR,Distribution Solutions Group Inc. Common Stock,$40.74,0.57,1.419%,1904894846.00,United States,,69374,Consumer Discretionary,Industrial Specialties
DSGX,Descartes Systems Group Inc. (The) Common Stock,$106.04,-1.34,-1.248%,9064365475.00,Canada,,121134,Technology,Computer Software: Prepackaged Software
DSL,DoubleLine Income Solutions Fund Common Shares of Beneficial Interests,$12.86,-0.04,-0.31%,1311679208.00,United States,2013,327966,Finance,Trusts Except Educational Religious and Charitable
DSM,BNY Mellon Strategic Municipal Bond Fund Inc. Common Stock,$6.18,0.04,0.651%,0.00,United States,1989,50599,Finance,Investment Managers
DSP,Viant Technology Inc. Class A Common Stock,$11.84,0.39,3.406%,748277131.00,United States,2021,51493,Technology,Computer Software: Programming Data Processing
DSS,DSS Inc. Common Stock,$1.24,0.0228,1.873%,8762797.00,United States,,20556,Consumer Discretionary,Containers/Packaging
DSU,Blackrock Debt Strategies Fund Inc. Common Stock,$10.86,-0.14,-1.273%,0.00,United States,1998,409071,Finance,Finance Companies
DSWL,Deswell Industries Inc. Common Shares,$2.63,0.00,0.00%,41909679.00,Macau,1995,2499,Industrials,Plastic Products
DSX,Diana Shipping inc. common stock,$2.38,-0.03,-1.245%,285511742.00,Greece,2005,415490,Consumer Discretionary,Marine Transportation
DSX^B,Diana Shipping Inc. Perpetual Preferred Shares Series B (Marshall Islands),$26.60,-0.045,-0.169%,,Greece,,3483,,
DSY,Big Tree Cloud Holdings Limited Ordinary Shares,$5.47,0.03,0.551%,312230587.00,China,,346870,Consumer Discretionary,Containers/Packaging
DSYWW,Big Tree Cloud Holdings Limited Warrants,$0.0393,0.005,14.577%,2243265.00,China,,52346,Consumer Discretionary,Containers/Packaging
DT,Dynatrace Inc. Common Stock,$53.70,0.02,0.037%,15997521269.00,United States,2019,1920886,Technology,Computer Software: Prepackaged Software
DTB,DTE Energy Company 2020 Series G 4.375% Junior Subordinated Debentures due 2080,$21.71,0.08,0.37%,4494405937.00,United States,2020,12964,Utilities,Electric Utilities: Central
DTC,Solo Brands Inc. Class A Common Stock,$1.38,0.03,2.222%,126449452.00,United States,2021,144157,Consumer Discretionary,Recreational Games/Products/Toys
DTCK,Davis Commodities Limited Ordinary Shares,$1.12,0.00,0.00%,27440700.00,Singapore,2023,12084,Industrials,Farming/Seeds/Milling
DTE,DTE Energy Company Common Stock,$128.47,1.08,0.848%,26595869678.00,United States,,780692,Utilities,Electric Utilities: Central
DTF,DTF Tax-Free Income 2028 Term Fund Inc. Common Stock,$11.29,0.00,0.00%,79363811.00,United States,1991,1493,Finance,Investment Managers
DTG,DTE Energy Company 2021 Series E 4.375% Junior Subordinated Debentures,$22.05,0.16,0.731%,4564792764.00,United States,2021,17800,Utilities,Electric Utilities: Central
DTI,Drilling Tools International Corporation Common Stock,$3.57,0.12,3.478%,123895765.00,United States,2021,22921,Industrials,Metal Fabrications
DTIL,Precision BioSciences Inc. Common Stock,$9.01,0.22,2.503%,65176178.00,United States,2019,99992,Health Care,Biotechnology: Biological Products (No Diagnostic Substances)
DTM,DT Midstream Inc. Common Stock ,$86.53,0.95,1.11%,8403073324.00,United States,2021,605191,Utilities,Natural Gas Distribution
DTSQ,DT Cloud Star Acquisition Corporation Ordinary Shares,$10.01,0.01,0.10%,0.00,United States,2024,89399,,
DTSQR,DT Cloud Star Acquisition Corporation Right,$0.13,0.008,6.557%,0.00,United States,2024,269,,
DTSQU,DT Cloud Star Acquisition Corporation Units,$10.13,0.09,0.896%,0.00,United States,2024,6404,,
DTSS,Datasea Inc. Common Stock,$2.19,-0.03,-1.351%,11288964.00,China,,103190,Technology,Computer Software: Prepackaged Software
DTST,Data Storage Corporation Common Stock,$3.63,0.06,1.681%,25394834.00,United States,,28748,Technology,EDP Services
DTSTW,Data Storage Corporation Warrant,$0.5196,-0.0053,-1.01%,3635029.00,United States,,502,Technology,EDP Services
DTW,DTE Energy Company 2017 Series E 5.25% Junior Subordinated Debentures due 2077,$24.89,-0.12,-0.48%,5152729791.00,United States,2017,27241,Utilities,Electric Utilities: Central
DUET,DUET Acquisition Corp. Class A Common Stock,$11.26,0.00,0.00%,0.00,Malaysia,2022,20,Finance,Blank Checks
DUK,Duke Energy Corporation (Holding Company) Common Stock,$119.78,2.66,2.271%,92494320345.00,United States,,4775837,Utilities,Power Generation
DUK^A,Duke Energy Corporation Depositary Shares each representing a 1/1000th interest in a share of 5.75% Series A Cumulative Redeemable Perpetual Preferred Stock,$25.55,0.10,0.393%,,United States,,41881,,
DUKB,Duke Energy Corporation 5.625% Junior Subordinated Debentures due 2078,$25.46,0.1599,0.632%,19660255435.00,United States,2018,11751,Utilities,Power Generation
DUO,Fangdd Network Group Ltd. Class A Ordinary Shares,$1.43,0.51,55.435%,9109100.00,China,2019,51408570,Finance,Real Estate
DUOL,Duolingo Inc. Class A Common Stock,$286.50,-4.09,-1.407%,12473851589.00,United States,2021,325066,Technology,Computer Software: Prepackaged Software
DUOT,Duos Technologies Group Inc. Common Stock,$4.14,0.37,9.814%,31836472.00,United States,,138802,Technology,Computer Software: Prepackaged Software
DV,DoubleVerify Holdings Inc. Common Stock,$17.12,-0.21,-1.212%,2911167164.00,United States,2021,1440213,Technology,Computer Software: Programming Data Processing
DVA,DaVita Inc. Common Stock,$164.82,0.25,0.152%,13828398000.00,United States,,513463,Health Care,Misc Health and Biotechnology Services
DVAX,Dynavax Technologies Corporation Common Stock,$11.03,0.27,2.509%,1445419544.00,United States,2004,1642740,Health Care,Biotechnology: Pharmaceutical Preparations
DVN,Devon Energy Corporation Common Stock,$40.69,-0.51,-1.238%,25480078000.00,United States,1985,7546435,Energy,Oil & Gas Production
DWSN,Dawson Geophysical Company Common Stock,$1.79,0.1899,11.868%,55323131.00,United States,,18991,Energy,Oil & Gas Production
DWTX,Dogwood Therapeutics Inc. Common Stock,$4.43,0.77,21.038%,5901947.00,United States,2020,207584,Health Care,Biotechnology: Pharmaceutical Preparations
DX,Dynex Capital Inc. Common Stock,$12.60,0.21,1.695%,941317978.00,United States,,1502938,Real Estate,Real Estate Investment Trusts
DX^C,Dynex Capital Inc. 6.900% Series C Fixed-to-Floating Rate Cumulative Redeemable Preferred Stock,$25.1894,0.0694,0.276%,,United States,,4649,,
DXC,DXC Technology Company Common Stock ,$21.00,0.63,3.093%,3797077830.00,United States,,1021949,Technology,EDP Services
DXCM,DexCom Inc. Common Stock,$69.90,2.80,4.173%,28010804998.00,United States,2005,4703488,Health Care,Medical/Dental Instruments
DXLG,Destination XL Group Inc. Common Stock,$2.95,0.13,4.61%,171860286.00,United States,,306341,Consumer Discretionary,Clothing/Shoe/Accessory Stores
DXPE,DXP Enterprises Inc. Common Stock,$51.22,-3.40,-6.225%,808697931.00,United States,,280937,Industrials,Industrial Machinery/Components
DXR,Daxor Corporation Common Stock,$9.00,0.00,0.00%,43560000.00,United States,,284,Health Care,Medical/Dental Instruments
DXYZ,Destiny Tech100 Inc. Common Stock,$11.33,-0.63,-5.268%,0.00,,2024,355686,,
DY,Dycom Industries Inc. Common Stock,$199.03,11.04,5.873%,5792597581.00,United States,,369935,Industrials,Water Sewer Pipeline Comm & Power Line Construction
DYAI,Dyadic International Inc. Common Stock,$1.16,0.08,7.407%,34194061.00,United States,,4661,Health Care,Biotechnology: Biological Products (No Diagnostic Substances)
DYCQ,DT Cloud Acquisition Corporation Ordinary Shares,$10.3359,-0.004,-0.039%,0.00,United Kingdom,2024,15440,,
DYCQR,DT Cloud Acquisition Corporation Right,$0.25,0.00,0.00%,0.00,United Kingdom,2024,55,,
DYCQU,DT Cloud Acquisition Corporation Unit,$10.46,0.00,0.00%,0.00,United Kingdom,2024,23,,
DYN,Dyne Therapeutics Inc. Common Stock,$35.40,1.81,5.389%,3554188249.00,United States,2020,933002,Health Care,Biotechnology: Pharmaceutical Preparations
E,ENI S.p.A. Common Stock,$30.55,0.10,0.328%,51567451331.00,Italy,,178512,Energy,Oil & Gas Production
EA,Electronic Arts Inc. Common Stock,$145.04,-1.38,-0.942%,38319557992.00,United States,,1282966,Technology,Computer Software: Prepackaged Software
EAD,Allspring Income Opportunities Fund Common Shares,$7.00,0.02,0.287%,0.00,United States,2003,118874,Finance,Finance/Investors Services
EAF,GrafTech International Ltd. Common Stock,$1.58,0.14,9.722%,406324061.00,United States,2018,1776165,Energy,Industrial Machinery/Components
EAI,Entergy Arkansas LLC First Mortgage Bonds 4.875% Series Due September 1 2066,$23.53,0.05,0.213%,5031439806.00,United States,2016,15792,Utilities,Electric Utilities: Central
EARN,Ellington Credit Company Common Shares of Beneficial Interest,$6.98,0.13,1.898%,176782397.00,United States,2013,347842,Real Estate,Real Estate Investment Trusts
EAST,Eastside Distilling Inc. Common Stock,$0.60,0.10,20.00%,1058093.00,United States,,374332,Consumer Staples,Beverages (Production/Distribution)
EAT,Brinker International Inc. Common Stock,$90.76,1.23,1.374%,4080400423.00,United States,,1104427,Consumer Discretionary,Restaurants
EB,Eventbrite Inc. Class A Common Stock,$2.95,0.08,2.787%,283498363.00,United States,2018,845539,Technology,Computer Software: Programming Data Processing
EBAY,eBay Inc. Common Stock,$66.92,-0.07,-0.104%,32723880000.00,United States,1998,2804340,Consumer Discretionary,Business Services
EBC,Eastern Bankshares Inc. Common Stock,$17.24,0.34,2.012%,3717776675.00,United States,2020,1270833,Finance,Savings Institutions
EBF,Ennis Inc. Common Stock,$21.38,0.31,1.471%,555962399.00,United States,,175569,Consumer Discretionary,Office Equipment/Supplies/Services
EBMT,Eagle Bancorp Montana Inc. Common Stock,$16.69,-0.06,-0.358%,133800125.00,United States,2010,33837,Finance,Major Banks
