Symbol,Name,Last Sale,Net Change,% Change,Market Cap,Country,IPO Year,Volume,Sector,Industry
PRH,Prudential Financial Inc. 5.950% Junior Subordinated Notes due 2062,$26.87,0.09,0.336%,9592590000.00,United States,2022,24708,Finance,Life Insurance
PRI,Primerica Inc. Common Stock,$281.55,2.88,1.033%,9524144169.00,United States,2010,136914,Finance,Life Insurance
PRIF^D,Priority Income Fund Inc. 7.00% Series D Term Preferred Stock due 2029,$24.51,-0.0766,-0.312%,,,,1551,,
PRIF^F,Priority Income Fund Inc. 6.625% Series F Term Preferred Stock due 2027,$24.27,0.06,0.248%,,,,400,,
PRIF^G,Priority Income Fund Inc. 6.25% Series G Preferred Stock Due 2026,$24.24,-0.21,-0.859%,,,,185,,
PRIF^H,Priority Income Fund Inc. 6.00% Series H Term Preferred Stock due 2026,$24.00,-0.1734,-0.717%,,,,1197,,
PRIF^I,Priority Income Fund Inc. 6.125% Series I Term Preferred Stock due 2028,$23.65,-0.83,-3.391%,,,,939,,
PRIF^J,Priority Income Fund Inc. 6.000% Series J Term Preferred Stock due 2028,$23.46,0.0113,0.048%,,,,2848,,
PRIF^K,Priority Income Fund Inc. 7.000% Series K Cumulative Preferred Stock,$22.55,-0.0979,-0.432%,,,,548,,
PRIF^L,Priority Income Fund Inc. 6.375% Series L Term Preferred Stock Due 2029,$23.80,0.1746,0.739%,,,,4143,,
PRIM,Primoris Services Corporation Common Stock,$61.73,0.97,1.596%,3313218240.00,United States,,633835,Industrials,Water Sewer Pipeline Comm & Power Line Construction
PRK,Park National Corporation Common Stock,$179.90,6.27,3.611%,2905680036.00,United States,1994,44188,Finance,Major Banks
PRKS,United Parks & Resorts Inc. Common Stock,$52.50,1.62,3.184%,3042457950.00,United States,2013,617130,Health Care,Biotechnology: Electromedical & Electrotherapeutic Apparatus
PRLB,Proto Labs Inc. Common stock,$29.13,0.80,2.824%,732550054.00,United States,2012,168803,Industrials,Metal Fabrications
PRLD,Prelude Therapeutics Incorporated Common Stock,$1.94,0.03,1.571%,106747472.00,United States,2020,699203,Health Care,Biotechnology: Pharmaceutical Preparations
PRLH,Pearl Holdings Acquisition Corp Class A Ordinary Shares,$11.19,0.0099,0.089%,0.00,United States,2022,207,Finance,Blank Checks
PRLHU,Pearl Holdings Acquisition Corp Unit,$11.19,0.41,3.803%,0.00,United States,2021,1476,Finance,Blank Checks
PRM,Perimeter Solutions SA Ordinary Shares,$13.41,0.27,2.055%,1947415997.00,Luxembourg,2021,634259,Industrials,Major Chemicals
PRME,Prime Medicine Inc. Common Stock,$3.96,0.19,5.04%,475322019.00,United States,2022,1482320,Health Care,Biotechnology: Biological Products (No Diagnostic Substances)
PRMW,Primo Water Corporation Common Stock,$26.91,0.31,1.165%,4314022453.00,Canada,,1009227,Consumer Staples,Beverages (Production/Distribution)
PRO,PROS Holdings Inc. Common Stock,$18.97,0.31,1.661%,895503701.00,United States,2007,582660,Technology,EDP Services
PROC,Procaps Group S.A. Ordinary Shares,$2.0501,0.0601,3.02%,231300858.00,Luxembourg,,958,Health Care,Biotechnology: Pharmaceutical Preparations
PROCW,Procaps Group S.A. Warrants,$0.024,-0.0012,-4.762%,2707780.00,Luxembourg,,7995,Health Care,Biotechnology: Pharmaceutical Preparations
PROF,Profound Medical Corp. Common Stock,$7.61,-0.02,-0.262%,186306764.00,Canada,,30050,Health Care,Medical/Dental Instruments
PROK,ProKidney Corp. Class A Ordinary Shares,$1.95,0.22,12.717%,564866673.00,United States,2021,436720,Health Care,Biotechnology: Biological Products (No Diagnostic Substances)
PROP,Prairie Operating Co. Common Stock,$8.68,0.29,3.456%,109062993.00,United States,,60385,Finance,Finance: Consumer Services
PROV,Provident Financial Holdings Inc. Common Stock,$14.90,0.60,4.196%,102257031.00,United States,,44265,Finance,Savings Institutions
PRPH,ProPhase Labs Inc. Common Stock (DE),$2.38,0.095,4.158%,45406899.00,United States,,62179,Health Care,Biotechnology: Pharmaceutical Preparations
PRPL,Purple Innovation Inc. Common Stock,$0.9387,0.0262,2.871%,101105387.00,United States,2015,222339,Consumer Discretionary,Home Furnishings
PRPO,Precipio Inc.  Common Stock,$6.842,0.222,3.353%,10140754.00,United States,,5836,Industrials,Biotechnology: Laboratory Analytical Instruments
PRQR,ProQR Therapeutics N.V. Ordinary Shares,$4.02,2.21,122.099%,327045460.00,Netherlands,2014,52110625,Health Care,Biotechnology: Pharmaceutical Preparations
PRS,Prudential Financial Inc. 5.625% Junior Subordinated Notes due 2058,$25.42,0.04,0.158%,9074940000.00,United States,2018,6842,Finance,Life Insurance
PRSO,Peraso Inc. Common Stock,$1.604,0.044,2.821%,4543922.00,United States,,68108,Technology,Semiconductors
PRT,PermRock Royalty Trust Trust Units,$4.00,0.04,1.01%,48662928.00,United States,2018,38004,Energy,Oil & Gas Production
PRTA,Prothena Corporation plc Ordinary Shares,$17.12,0.20,1.182%,920719506.00,United States,,466312,Health Care,Biotechnology: Pharmaceutical Preparations
PRTC,PureTech Health plc American Depositary Shares,$20.13,-0.245,-1.202%,481955097.00,United States,,1228,Health Care,Biotechnology: Pharmaceutical Preparations
PRTG,Portage Biotech Inc. Common Stock,$6.70,0.44,7.029%,7025714.00,Canada,,117457,Energy,Oil & Gas Production
PRTH,Priority Technology Holdings Inc. Common Stock,$6.51,0.16,2.52%,500174035.00,United States,2016,163836,Consumer Discretionary,Business Services
PRTS,CarParts.com Inc. Common Stock,$0.8145,0.015,1.876%,46662693.00,United States,2007,330823,Consumer Discretionary,Auto & Home Supply Stores
PRU,Prudential Financial Inc. Common Stock,$127.03,1.20,0.954%,45349710000.00,United States,2001,1459266,Finance,Life Insurance
PRVA,Privia Health Group Inc. Common Stock,$18.11,0.49,2.781%,2165321643.00,United States,2021,671978,Health Care,Medical/Nursing Services
PRZO,ParaZero Technologies Ltd. Ordinary Shares,$0.6689,0.0089,1.348%,7464924.00,Israel,2023,116607,Industrials,Military/Government/Technical
PSA,Public Storage Common Stock,$347.64,2.65,0.768%,60843405267.00,United States,,443967,Real Estate,Real Estate Investment Trusts
PSA^F,Public Storage Depositary Shares Each Representing 1/1000 of a 5.15% Cumulative Preferred Share of Beneficial Interest Series F par value $0.01 per share,$24.99,0.06,0.241%,,United States,,14734,,
PSA^G,Public Storage Depositary Shares Each Representing 1/1000 of a 5.05% Cumulative Preferred Share of Beneficial Interest Series G,$24.90,0.15,0.606%,,United States,,24768,,
PSA^H,Public Storage Depositary Shares Each Representing 1/1000 of a  5.60% Cumulative Preferred  Share of Beneficial Interest Series H,$25.20,0.03,0.119%,,United States,,10438,,
PSA^I,Public Storage Depositary Shares Each Representing 1/1000 of a 4.875% Cumulative Preferred Share of Beneficial Interest Series I par value $0.01 per share,$23.72,0.14,0.594%,,United States,,18651,,
PSA^J,Public Storage Depositary Shares Each Representing 1/1000 of a 4.700% Cumulative Preferred Share of Beneficial Interest Series J par value $0.01 per share,$23.18,0.18,0.783%,,United States,,5194,,
PSA^K,Public Storage Depositary Shares Each Representing 1/1000 of a 4.75% Cumulative Preferred Share of Beneficial Interest Series K,$23.12,0.166,0.723%,,United States,,4672,,
PSA^L,Public Storage Depositary Shares Each Representing 1/1000 of a 4.625% Cumulative Preferred Share of Beneficial Interest Series L par value $0.01 per share,$22.715,0.135,0.598%,,United States,,17046,,
PSA^M,Public Storage Depositary Shares Each Representing 1/1000 of a 4.125% Cumulative Preferred Share of Beneficial Interest Series M,$20.47,0.19,0.937%,,United States,,12056,,
PSA^N,Public Storage Depositary Shares Each Representing 1/1000 of a 3.875% Cumulative Preferred Share of Beneficial Interest Series N,$19.07,0.15,0.793%,,United States,,5711,,
PSA^O,Public Storage Depositary Shares Each Representing 1/1000 of a 3.900% Cumulative Preferred Share of Beneficial Interest Series O,$18.97,0.21,1.119%,,United States,,22015,,
PSA^P,Public Storage Depositary Shares Each Representing 1/1000 of a 4.000% Cumulative Preferred Share of Bene cial Interest Series P,$19.71,0.16,0.818%,,United States,,38595,,
PSA^Q,Public Storage Depositary Shares Each Representing 1/1000 of a 3.950% Cumulative Preferred Share of Beneficial Interest Series Q par value $0.01 per share,$19.25,0.13,0.68%,,United States,,10785,,
PSA^R,Public Storage Depositary Shares Each Representing 1/1000 of a 4.00% Cumulative Preferred Share of Bene cial Interest Series R,$19.94,0.09,0.453%,,United States,,12247,,
PSA^S,Public Storage Depositary Shares Each Representing 1/1000 of a 4.100% Cumulative Preferred Share of Beneficial Interest Series S,$20.35,0.21,1.043%,,United States,,8746,,
PSBD,Palmer Square Capital BDC Inc. Common Stock,$16.30,0.16,0.991%,0.00,,2024,48951,,
PSEC,Prospect Capital Corporation Common Stock,$5.28,0.10,1.931%,2265057786.00,United States,2004,1571039,Finance,Finance: Consumer Services
PSEC^A,Prospect Capital Corporation 5.35% Series A Fixed Rate Cumulative Perpetual Preferred Stock,$20.88,-0.05,-0.239%,,United States,,13624,,
PSF,Cohen & Steers Select Preferred and Income Fund Inc. Common Stock,$20.88,0.01,0.048%,1026014553.00,,2010,75147,Finance,Investment Managers
PSFE,Paysafe Limited Common Shares,$23.25,1.19,5.394%,1434977050.00,,2021,278337,Consumer Discretionary,Business Services
PSHG,Performance Shipping Inc. Common Shares,$1.8593,-0.0057,-0.306%,22831602.00,Greece,,47492,Consumer Discretionary,Marine Transportation
PSIG,PS International Group Ltd. Ordinary Shares,$0.84,-0.0043,-0.509%,20397667.00,Hong Kong,,62984,Consumer Discretionary,Oil Refining/Marketing
PSMT,PriceSmart Inc. Common Stock,$93.26,0.05,0.054%,2857392487.00,United States,,98178,Consumer Discretionary,Department/Specialty Retail Stores
PSN,Parsons Corporation Common Stock,$108.14,-0.46,-0.424%,11482860174.00,United States,2019,619306,Technology,EDP Services
PSNL,Personalis Inc. Common Stock,$4.78,-0.09,-1.848%,315097600.00,United States,2019,324062,Health Care,Medical Specialities
PSNY,Polestar Automotive Holding UK PLC Class A ADS,$1.26,0.06,5.00%,2690364963.00,Sweden,,4832597,Consumer Discretionary,Auto Manufacturing
PSNYW,Polestar Automotive Holding UK PLC Class C-1 ADS (ADW),$0.2182,-0.0178,-7.542%,465902885.00,Sweden,,159012,Consumer Discretionary,Auto Manufacturing
PSO,Pearson Plc Common Stock,$13.43,0.02,0.149%,8947091034.00,United Kingdom,,215670,Consumer Discretionary,Books
PSQH,PSQ Holdings Inc. Class A Common Stock,$2.63,-0.01,-0.379%,82559895.00,,2021,78425,Consumer Discretionary,Advertising
PSTG,Pure Storage Inc. Class A Common Stock,$53.42,0.83,1.578%,17505300977.00,United States,2015,2164614,Technology,Electronic Components
PSTL,Postal Realty Trust Inc. Class A Common Stock,$14.64,0.19,1.315%,337207893.00,United States,2019,82180,Real Estate,Real Estate Investment Trusts
PSTV,PLUS THERAPEUTICS Inc. Common Stock ,$1.43,0.02,1.418%,8431756.00,United States,,26554,Health Care,Medical/Dental Instruments
PSTX,Poseida Therapeutics Inc. Common Stock,$2.54,0.00,0.00%,246685245.00,United States,2020,416826,Health Care,Biotechnology: Biological Products (No Diagnostic Substances)
PSX,Phillips 66 Common Stock,$132.31,0.91,0.693%,55380888603.00,United States,,1461188,Energy,Integrated oil Companies
PT,Pintec Technology Holdings Limited American Depositary Shares,$0.951,0.0409,4.494%,15166511.00,China,2018,73710,Technology,Computer Software: Programming Data Processing
PTA,Cohen & Steers Tax-Advantaged Preferred Securities and Income Fund Common Shares of Beneficial Interest,$21.10,0.17,0.812%,1166269943.00,United States,2020,93576,Finance,Trusts Except Educational Religious and Charitable
PTC,PTC Inc. Common Stock,$184.48,0.47,0.255%,22162547415.00,United States,,609761,Technology,Computer Software: Prepackaged Software
PTCT,PTC Therapeutics Inc. Common Stock,$36.70,-0.86,-2.29%,2823117039.00,United States,2013,667245,Health Care,Biotechnology: Pharmaceutical Preparations
PTEN,Patterson-UTI Energy Inc. Common Stock,$8.05,0.16,2.028%,3164050930.00,United States,1993,8444116,Energy,Oil & Gas Production
PTGX,Protagonist Therapeutics Inc. Common Stock,$46.99,-0.65,-1.364%,2767926449.00,United States,2016,614828,Health Care,Biotechnology: Pharmaceutical Preparations
PTHL,Pheton Holdings Ltd Class A Ordinary Shares,$4.99,-0.44,-8.103%,72355000.00,China,2024,168115,Health Care,Biotechnology: Electromedical & Electrotherapeutic Apparatus
PTIX,Protagenic Therapeutics Inc. Common Stock,$0.559,0.0079,1.433%,2497202.00,United States,,64753,Health Care,Biotechnology: Pharmaceutical Preparations
PTLE,PTL LTD Ordinary Shares,$4.07,0.07,1.75%,0.00,Singapore,,2692777,,
PTLO,Portillo's Inc. Class A Common Stock,$12.65,-0.11,-0.862%,781701968.00,United States,2021,628768,Consumer Discretionary,Restaurants
PTMN,Portman Ridge Finance Corporation Common Stock,$18.38,0.33,1.828%,169905161.00,United States,2006,28406,Finance,Finance: Consumer Services
PTN,Palatin Technologies Inc. Common Stock,$0.94,0.066,7.551%,18375277.00,United States,1999,145376,Health Care,Biotechnology: Pharmaceutical Preparations
PTON,Peloton Interactive Inc. Class A Common Stock,$5.26,0.05,0.96%,1979966097.00,United States,2019,11218547,Consumer Discretionary,Recreational Games/Products/Toys
PTPI,Petros Pharmaceuticals Inc. Common Stock,$0.3498,0.045,14.764%,3360416.00,United States,,738262,Health Care,Biotechnology: Pharmaceutical Preparations
PTSI,P.A.M. Transportation Services Inc. Common Stock,$17.54,0.79,4.716%,381582893.00,United States,1986,68365,Industrials,Trucking Freight/Courier Services
PTVE,Pactiv Evergreen Inc. Common stock,$11.90,-0.15,-1.245%,2133130180.00,United States,2020,225185,Consumer Discretionary,Containers/Packaging
PTY,Pimco Corporate & Income Opportunity Fund,$14.45,0.06,0.417%,0.00,United States,2002,759762,Finance,Investment Managers
PUBM,PubMatic Inc. Class A Common Stock,$15.02,-0.27,-1.766%,744753347.00,United States,2020,264178,Technology,Computer Software: Programming Data Processing
PUK,Prudential Public Limited Company Common Stock,$17.31,0.15,0.874%,23408983693.00,United Kingdom,,737140,Finance,Life Insurance
PULM,Pulmatrix Inc. Common Stock,$2.1301,0.0401,1.919%,7779732.00,United States,2014,8534,Health Care,Biotechnology: Pharmaceutical Preparations
PUMP,ProPetro Holding Corp. Common Stock,$8.17,0.14,1.743%,851004986.00,United States,2017,918231,Energy,Oilfield Services/Equipment
PVBC,Provident Bancorp Inc. (MD) Common Stock,$10.82,0.26,2.462%,191160478.00,United States,2015,33226,Finance,Banks
PVH,PVH Corp. Common Stock,$98.70,1.27,1.303%,5508851473.00,United States,,615349,Consumer Discretionary,Apparel
PVL,Permianville Royalty Trust Trust Units ,$1.588,0.018,1.146%,52404000.00,United States,2011,36779,Energy,Oil & Gas Production
PW,Power REIT (MD) Common Stock,$1.14,-0.07,-5.785%,3864214.00,United States,1998,214029,Real Estate,Real Estate Investment Trusts
PW^A,Power REIT 7.75% Series A Cumulative Perpetual Preferred Stock,$3.47,0.00,0.00%,,United States,,302,,
PWM,Prestige Wealth Inc. Class A Ordinary Shares,$0.8057,0.0358,4.65%,7372155.00,Hong Kong,2023,88951,Finance,Finance: Consumer Services
PWOD,Penns Woods Bancorp Inc. Common Stock,$24.85,0.35,1.429%,187481595.00,United States,,4989,Finance,Major Banks
PWP,Perella Weinberg Partners Class A Common Stock,$21.99,0.28,1.29%,1887604404.00,United States,2020,258541,Finance,Finance: Consumer Services
PWR,Quanta Services Inc. Common Stock,$312.22,6.68,2.186%,45999303599.00,United States,,491239,Industrials,Engineering & Construction
PWUP,PowerUp Acquisition Corp. Class A Ordinary Shares,$11.71,-0.59,-4.797%,0.00,United States,2022,13390,Finance,Blank Checks
PWUPU,PowerUp Acquisition Corp. Unit,$12.0998,-1.4902,-10.965%,0.00,United States,2022,3717,Finance,Blank Checks
PX,P10 Inc. Class A Common Stock,$11.41,0.21,1.875%,1274256226.00,United States,2021,346027,Finance,Investment Managers
PXDT,Pixie Dust Technologies Inc. American Depositary Shares ,$1.6547,-0.0103,-0.619%,24603845.00,Japan,2023,1892,Health Care,Biotechnology: Electromedical & Electrotherapeutic Apparatus
PXLW,Pixelworks Inc.  Common Stock,$0.8511,-0.0589,-6.473%,49833338.00,United States,2000,243045,Technology,Semiconductors
PXS,Pyxis Tankers Inc. Common Stock,$4.76,-0.135,-2.758%,50182524.00,Greece,,59360,Consumer Discretionary,Marine Transportation
PXSAP,Pyxis Tankers Inc. 7.75% Series A Cumulative Convertible Preferred Shares,$24.96,-0.0141,-0.056%,263141973.00,Greece,,1371,Consumer Discretionary,Marine Transportation
PXSAW,Pyxis Tankers Inc. Warrant,$0.7898,-0.0001,-0.013%,8326504.00,Greece,,60,Consumer Discretionary,Marine Transportation
PYCR,Paycor HCM Inc. Common Stock,$13.79,0.04,0.291%,2465956966.00,United States,2021,2022684,Technology,Computer Software: Prepackaged Software
PYN,PIMCO New York Municipal Income Fund III Common Shares of Beneficial Interest,$6.14,0.02,0.327%,0.00,United States,2002,13607,Finance,Investment Managers
PYPD,PolyPid Ltd. Ordinary Shares,$3.43,0.03,0.882%,23335930.00,Israel,2020,5530,Health Care,Biotechnology: Pharmaceutical Preparations
PYPL,PayPal Holdings Inc. Common Stock,$80.82,1.27,1.596%,82624984822.00,United States,,5430174,Consumer Discretionary,Business Services
PYXS,Pyxis Oncology Inc. Common Stock,$3.30,0.06,1.852%,194509402.00,United States,2021,350679,Health Care,Biotechnology: Pharmaceutical Preparations
PZC,PIMCO California Municipal Income Fund III Common Shares of Beneficial Interest,$7.41,0.035,0.475%,0.00,United States,2002,49447,Finance,Investment Managers
PZG,Paramount Gold Nevada Corp. Common Stock,$0.42,0.0037,0.889%,27366874.00,United States,2015,39457,Basic Materials,Metal Mining
PZZA,Papa John's International Inc. Common Stock,$53.75,2.12,4.106%,1753641373.00,United States,1993,795901,Consumer Discretionary,Restaurants
QBTS,D-Wave Quantum Inc. Common Shares,$1.04,0.0425,4.261%,209486469.00,,2022,10520593,Technology,EDP Services
QCOM,QUALCOMM Incorporated Common Stock,$171.48,-2.61,-1.499%,191028720000.00,United States,1991,6490256,Technology,Radio And Television Broadcasting And Communications Equipment
QCRH,QCR Holdings Inc. Common Stock,$81.55,1.93,2.424%,1373458821.00,United States,,78319,Finance,Major Banks
QD,Qudian Inc. American Depositary Shares each representing one Class A Ordinary Share,$2.19,0.13,6.311%,414794434.00,China,2017,566660,Finance,Finance: Consumer Services
QDEL,QuidelOrtho Corporation Common Stock,$39.98,-0.22,-0.547%,2688071052.00,United States,,953954,Health Care,Biotechnology: In Vitro & In Vivo Diagnostic Substances
QETA,Quetta Acquisition Corporation Common Stock,$10.45,0.015,0.144%,0.00,United States,2023,20230,Finance,Blank Checks
QETAR,Quetta Acquisition Corporation Right,$1.30,-0.20,-13.333%,0.00,United States,2023,2108,Finance,Blank Checks
QETAU,Quetta Acquisition Corporation Unit,$10.83,0.32,3.045%,0.00,United States,2023,7332,Finance,Blank Checks
QFIN,Qifu Technology Inc. American Depositary Shares,$32.50,1.20,3.834%,5045770438.00,China,2018,916359,Finance,Finance: Consumer Services
QGEN,Qiagen N.V. Common Shares,$43.21,-0.67,-1.527%,9860641044.00,Netherlands,,1540926,Health Care,Biotechnology: Biological Products (No Diagnostic Substances)
QH,Quhuo Limited American Depository Shares,$1.65,-0.04,-2.367%,10176575.00,China,2020,268171,Consumer Discretionary,Business Services
QIPT,Quipt Home Medical Corp. Common Shares,$3.04,0.10,3.401%,130993600.00,United States,,165050,Health Care,Misc Health and Biotechnology Services
QLGN,Qualigen Therapeutics Inc. Common Stock,$0.1611,-0.0018,-1.105%,1958304.00,United States,2015,381559,Health Care,Biotechnology: Pharmaceutical Preparations
QLYS,Qualys Inc. Common Stock,$126.14,0.11,0.087%,4643341811.00,United States,2012,306414,Technology,Computer Software: Prepackaged Software
QMCO,Quantum Corporation Common Stock,$3.66,0.16,4.571%,17541245.00,United States,,30528,Technology,Electronic Components
QMMM,QMMM Holdings Limited Ordinary Shares,$8.51,-0.16,-1.845%,145733750.00,Hong Kong,2024,1803058,Consumer Discretionary,Advertising
QNCX,Quince Therapeutics Inc. Common Stock,$0.819,0.046,5.951%,35443540.00,United States,2019,88237,Health Care,Biotechnology: Biological Products (No Diagnostic Substances)
QNRX,Quoin Pharmaceuticals Ltd. American Depositary Shares,$0.79,0.286,56.746%,3144176.00,Israel,2016,84167054,Health Care,Medical/Dental Instruments
QNST,QuinStreet Inc. Common Stock,$19.43,-0.17,-0.867%,1087615506.00,United States,2010,214937,Consumer Discretionary,Business Services
QNTM,Quantum Biopharma Ltd. Class B Subordinate Voting Shares,$5.39,0.59,12.292%,7009587.00,Canada,,194259,Health Care,Biotechnology: Pharmaceutical Preparations
QOMO,Qomolangma Acquisition Corp. Common Stock,$11.40,0.00,0.00%,0.00,United States,2022,712,Finance,Blank Checks
QOMOU,Qomolangma Acquisition Corp. Unit,$11.56,0.15,1.315%,0.00,United States,2022,5144,Finance,Blank Checks
QQQX,Nuveen NASDAQ 100 Dynamic Overwrite Fund Shares of Beneficial Interest,$25.23,0.03,0.119%,0.00,United States,,49328,Finance,Finance Companies
QRHC,Quest Resource Holding Corporation Common Stock,$8.29,0.23,2.854%,168978825.00,United States,,40197,Utilities,Environmental Services
QRTEA,Qurate Retail Inc. Series A Common Stock ,$0.6061,0.0029,0.481%,240574149.00,United States,,1009828,Consumer Discretionary,Catalog/Specialty Distribution
QRTEB,Qurate Retail Inc. Series B Common Stock ,$3.80,0.00,0.00%,1508301875.00,United States,,1763,Consumer Discretionary,Catalog/Specialty Distribution
QRTEP,Qurate Retail Inc. 8.0% Fixed Rate Cumulative Redeemable Preferred Stock,$41.00,0.06,0.147%,16273783386.00,United States,,46656,Consumer Discretionary,Catalog/Specialty Distribution
QRVO,Qorvo Inc. Common Stock,$104.00,0.42,0.405%,9865579984.00,United States,,823651,Technology,Semiconductors
QS,QuantumScape Corporation Class A Common Stock,$5.51,0.02,0.364%,2788685787.00,United States,2020,3885763,Miscellaneous,Industrial Machinery/Components
QSG,QuantaSing Group Limited American Depositary Shares,$3.54,0.005,0.141%,180940031.00,China,2023,179685,Real Estate,Other Consumer Services
QSI,Quantum-Si Incorporated Class A Common Stock,$0.8164,-0.0256,-3.04%,116223767.00,United States,2020,602850,Industrials,Industrial Machinery/Components
QSIAW,Quantum-Si Incorporated Warrant,$0.0794,-0.0001,-0.126%,11303487.00,United States,2020,7100,Industrials,Industrial Machinery/Components
QSR,Restaurant Brands International Inc. Common Shares,$72.12,0.91,1.278%,32497394820.00,Canada,2014,1117104,Consumer Discretionary,Restaurants
QTI,QT Imaging Holdings Inc. Common Stock,$0.64,0.0259,4.218%,13722506.00,United States,,64430,Health Care,Biotechnology: Electromedical & Electrotherapeutic Apparatus
QTRX,Quanterix Corporation Common Stock,$12.81,0.33,2.644%,491635413.00,United States,2017,426318,Industrials,Biotechnology: Laboratory Analytical Instruments
QTTB,Q32 Bio Inc. Common Stock,$50.01,1.54,3.177%,603109898.00,United States,2018,132071,Health Care,Biotechnology: Pharmaceutical Preparations
QTWO,Q2 Holdings Inc. Common Stock,$80.42,-0.84,-1.034%,4847972692.00,United States,2014,1117780,Technology,Computer Software: Prepackaged Software
QUAD,Quad Graphics Inc Class A Common Stock,$5.71,0.22,4.007%,297839653.00,United States,,181262,Consumer Discretionary,Publishing
QUBT,Quantum Computing Inc. Common Stock,$0.76,0.0482,6.772%,69422306.00,United States,,916178,Technology,Computer Software: Prepackaged Software
QUIK,QuickLogic Corporation Common Stock,$8.19,-0.41,-4.767%,118473338.00,United States,1999,164169,Technology,Semiconductors
QURE,uniQure N.V. Ordinary Shares,$6.47,0.83,14.716%,315073595.00,Netherlands,2014,1355011,Health Care,Biotechnology: Pharmaceutical Preparations
QVCC,QVC Inc. 6.250% Senior Secured Notes due 2068,$13.92,0.03,0.216%,14.00,United States,2019,22361,Consumer Discretionary,Catalog/Specialty Distribution
QVCD,QVC Inc. 6.375% Senior Secured Notes due 2067,$14.00,0.08,0.575%,14.00,United States,2018,31108,Consumer Discretionary,Catalog/Specialty Distribution
QXO,QXO Inc. Common Stock,$15.41,0.07,0.456%,6309319305.00,United States,,916239,Technology,EDP Services
R,Ryder System Inc. Common Stock,$151.85,1.08,0.716%,6572551339.00,United States,,302229,Consumer Discretionary,Rental/Leasing Companies
RA,Brookfield Real Assets Income Fund Inc. Common Stock,$13.50,0.04,0.297%,0.00,United States,2016,222122,Finance,Investment Managers
RACE,Ferrari N.V. Common Shares,$471.99,1.22,0.259%,115048016554.00,Italy,2015,158393,Consumer Discretionary,Auto Manufacturing
RAIL,FreightCar America Inc. Common Stock,$12.09,0.30,2.545%,228184847.00,United States,2005,179973,Industrials,Railroads
RAMP,LiveRamp Holdings Inc. Common Stock,$24.78,-0.13,-0.522%,1650636588.00,United States,2018,356632,Technology,EDP Services
RAND,Rand Capital Corporation Common Stock,$16.60,0.2099,1.281%,42844949.00,United States,,4284,Finance,Finance: Consumer Services
RANI,Rani Therapeutics Holdings Inc. Class A Common Stock,$2.60,0.48,22.642%,138856921.00,United States,2021,8400551,Health Care,Biotechnology: Pharmaceutical Preparations
RAPP,Rapport Therapeutics Inc. Common Stock,$29.23,3.35,12.944%,1069129838.00,United States,2024,386947,Health Care,Biotechnology: Pharmaceutical Preparations
RAPT,RAPT Therapeutics Inc. Common Stock,$1.75,-0.06,-3.315%,61081083.00,United States,2019,114380,Health Care,Biotechnology: Pharmaceutical Preparations
RARE,Ultragenyx Pharmaceutical Inc. Common Stock,$57.70,0.58,1.015%,5317931463.00,United States,2014,658783,Health Care,Biotechnology: Pharmaceutical Preparations
RAVE,Rave Restaurant Group Inc. Common Stock,$2.62,-0.09,-3.321%,38216803.00,United States,,115321,Consumer Discretionary,Food Distributors
RAY,Raytech Holding Limited Ordinary Shares,$1.55,-0.13,-7.738%,27300279.00,Hong Kong,2024,20149,Consumer Discretionary,Consumer Electronics/Appliances
RAYA,Erayak Power Solution Group Inc. Class A Ordinary Shares,$1.04,0.245,30.818%,12948000.00,China,2022,574827,Consumer Discretionary,Metal Fabrications
