Symbol,Name,Last Sale,Net Change,% Change,Market Cap,Country,IPO Year,Volume,Sector,Industry
JOUT,Johnson Outdoors Inc. Class A Common Stock,$34.62,1.12,3.343%,356738051.00,United States,,42034,Consumer Discretionary,Recreational Games/Products/Toys
JPC,Nuveen Preferred & Income Opportunities Fund,$8.10,0.02,0.248%,0.00,United States,2003,907805,Finance,Investment Managers
JPI,Nuveen Preferred Securities & Income Opportunities Fund Common Shares,$20.97,0.02,0.095%,477537626.00,,2012,41958,Finance,Finance Companies
JPM,JP Morgan Chase & Co. Common Stock,$223.64,1.25,0.562%,636292639546.00,United States,,6380719,Finance,Major Banks
JPM^C,J P Morgan Chase & Co Depositary Shares each representing a 1/400th interest in a share of 6.00% Non-Cumulative  Preferred Stock Series EE,$25.43,0.01,0.039%,,United States,,153033,,
JPM^D,J P Morgan Chase & Co Depositary Shares each representing a 1/400th  interest in a share of 5.75% Non-Cumulative  Preferred Stock Series DD,$25.30,0.03,0.119%,,United States,,100033,,
JPM^J,J P Morgan Chase & Co Depositary Shares each representing a 1/400th interest in a share of JPMorgan Chase & Co. 4.75% Non-Cumulative Preferred Stock Series GG,$23.89,0.08,0.336%,,United States,,49637,,
JPM^K,J P Morgan Chase & Co Depositary Shares each representing a 1/400th interest in a share of 4.55% Non-Cumulative Preferred Stock Series JJ,$22.60,0.09,0.40%,,United States,,110874,,
JPM^L,J P Morgan Chase & Co Depositary Shares each representing a 1/400th interest in a share of 4.625% Non-Cumulative Preferred Stock Series LL,$23.03,0.08,0.349%,,United States,,93123,,
JPM^M,J P Morgan Chase & Co Depositary Shares each representing a 1/400th interest in a share of 4.20% Non-Cumulative Preferred Stock Series MM,$21.15,0.07,0.332%,,United States,,154564,,
JQC,Nuveen Credit Strategies Income Fund Shares of Beneficial Interest,$5.73,-0.04,-0.693%,0.00,United States,2003,523208,Finance,Finance Companies
JRI,Nuveen Real Asset Income and Growth Fund Common Shares of Beneficial Interest,$13.17,0.14,1.074%,0.00,United States,2012,159513,Finance,Finance Companies
JRS,Nuveen Real Estate Income Fund Common Shares of Beneficial Interest,$9.04,0.05,0.556%,0.00,United States,2001,64971,Finance,Finance/Investors Services
JRSH,Jerash Holdings (US) Inc. Common Stock,$3.05,0.01,0.329%,37499262.00,United States,2018,4672,Consumer Discretionary,Apparel
JRVR,James River Group Holdings Ltd. Common Shares,$6.80,0.20,3.03%,257215216.00,Bermuda,2014,231727,Finance,Property-Casualty Insurers
JSM,Navient Corporation 6% Senior Notes due December 15 2043,$20.60,0.15,0.733%,2253847936.00,United States,,10743,Finance,Finance: Consumer Services
JSPR,Jasper Therapeutics Inc. Common Stock,$18.18,-0.10,-0.547%,274614354.00,United States,2020,181430,Health Care,Biotechnology: Biological Products (No Diagnostic Substances)
JSPRW,Japer Therapeutics Inc. Warrants,$0.207,0.0233,12.684%,3126797.00,United States,2020,423,Health Care,Biotechnology: Biological Products (No Diagnostic Substances)
JTAI,Jet.AI Inc. Common Stock,$0.0861,-0.0068,-7.32%,2116069.00,United States,2021,24135608,Consumer Discretionary,Transportation Services
JUNE,Junee Limited Ordinary Shares,$5.47,0.07,1.296%,69547144.00,Hong Kong,2024,47153,,
JVA,Coffee Holding Co. Inc. Common Stock,$3.36,0.29,9.446%,19180893.00,United States,2005,47351,Consumer Staples,Packaged Foods
JVSA,JV SPAC Acquisition Corp. Class A Ordinary Share,$10.33,0.02,0.194%,0.00,China,2024,1295,,
JVSAR,JV SPAC Acquisition Corp. Right,$0.32,0.00,0.00%,0.00,China,2024,100,,
JWEL,Jowell Global Ltd. Ordinary Shares,$1.5899,-0.0301,-1.858%,3450838.00,China,2021,2654,Consumer Discretionary,Other Consumer Services
JWN,Nordstrom Inc. Common Stock,$24.42,0.34,1.412%,4010032351.00,United States,,2412314,Consumer Discretionary,Clothing/Shoe/Accessory Stores
JWSM,Jaws Mustang Acquisition Corp. Class A Ordinary Shares,$11.31,0.00,0.00%,0.00,,2021,1755,Finance,Blank Checks
JXJT,JX Luxventure Limited Common Stock,$1.61,-0.20,-11.05%,9761739.00,China,2013,99345,Consumer Staples,Apparel
JXN,Jackson Financial Inc. Class A Common Stock ,$99.98,1.02,1.031%,7522596780.00,United States,2021,670781,Finance,Life Insurance
JXN^A,Jackson Financial Inc. Depositary Shares each representing a 1/1000th interest in a share of Fixed-Rate Reset Noncumulative Perpetual Preferred Stock Series A,$27.30,0.11,0.405%,,United States,,30244,,
JYD,Jayud Global Logistics Limited Class A Ordinary Shares,$0.7576,-0.0324,-4.101%,16176444.00,China,2023,27194,Consumer Discretionary,Oil Refining/Marketing
JYNT,The Joint Corp. Common Stock,$11.47,0.87,8.208%,172013009.00,United States,2014,93194,Miscellaneous,Multi-Sector Companies
JZ,Jianzhi Education Technology Group Company Limited American Depositary Shs,$1.00,-0.09,-8.257%,20185000.00,China,2022,4162,Real Estate,Other Consumer Services
JZXN,Jiuzi Holdings Inc. Ordinary Shares,$1.4599,0.0099,0.683%,13217932.00,China,2021,8400,Consumer Discretionary,Retail-Auto Dealers and Gas Stations
K,Kellanova Common Stock,$81.06,0.13,0.161%,27745848663.00,United States,,808928,Consumer Staples,Packaged Foods
KACL,Kairous Acquisition Corp. Limited Ordinary Shares,$12.32,0.05,0.407%,0.00,Malaysia,2022,2701,Finance,Blank Checks
KACLR,Kairous Acquisition Corp. Limited Rights,$0.0937,0.0236,33.666%,0.00,Malaysia,2022,1000,Finance,Blank Checks
KACLU,Kairous Acquisition Corp. Limited Unit,$12.33,-0.17,-1.36%,0.00,Malaysia,2021,1732,Finance,Blank Checks
KACLW,Kairous Acquisition Corp. Limited Warrants,$0.0144,-0.0105,-42.169%,0.00,Malaysia,2022,5366,Finance,Blank Checks
KAI,Kadant Inc Common Stock,$334.83,5.30,1.608%,3932432364.00,United States,1992,42168,Industrials,Industrial Machinery/Components
KALA,KALA BIO Inc. Common Stock,$5.26,0.06,1.154%,24235813.00,United States,2017,10031,Health Care,Biotechnology: Pharmaceutical Preparations
KALU,Kaiser Aluminum Corporation Common Stock,$72.09,0.52,0.727%,1159719904.00,United States,,125306,Industrials,Metal Fabrications
KALV,KalVista Pharmaceuticals Inc. Common Stock,$12.33,0.35,2.922%,532846770.00,United Kingdom,2015,251766,Health Care,Biotechnology: Pharmaceutical Preparations
KAPA,Kairos Pharma Ltd. Common Stock,$1.52,-0.03,-1.935%,19519744.00,,2024,65599,Health Care,Biotechnology: Pharmaceutical Preparations
KAR,OPENLANE Inc. Common Stock,$16.17,0.32,2.019%,1756374825.00,United States,2009,422547,Consumer Discretionary,Retail-Auto Dealers and Gas Stations
KARO,Karooooo Ltd. Ordinary Shares,$38.94,0.54,1.406%,1203246000.00,Singapore,2021,339315,Technology,Computer Software: Prepackaged Software
KAVL,Kaival Brands Innovations Group Inc. Common Stock,$0.8221,-0.008,-0.964%,5577092.00,United States,,128476,Consumer Discretionary,Other Consumer Services
KB,KB Financial Group Inc,$69.61,1.46,2.142%,26358788858.00,South Korea,,188881,Finance,Commercial Banks
KBDC,Kayne Anderson BDC Inc. Common Stock,$16.03,-0.08,-0.497%,0.00,,2024,33759,,
KBH,KB Home Common Stock,$84.31,1.87,2.268%,6182829756.00,United States,1986,1119584,Consumer Discretionary,Homebuilding
KBR,KBR Inc. Common Stock,$68.65,0.78,1.149%,9133894857.00,United States,2006,1035744,Industrials,Military/Government/Technical
KC,Kingsoft Cloud Holdings Limited American Depositary Shares,$2.75,0.02,0.733%,697635546.00,China,2020,1781883,Technology,Computer Software: Prepackaged Software
KD,Kyndryl Holdings Inc. Common Stock,$25.03,0.10,0.401%,5787123325.00,United States,2021,947354,Technology,EDP Services
KDLY,Kindly MD Inc. Common Stock,$1.20,-0.04,-3.226%,7136603.00,United States,2024,147061,Health Care,Medical/Nursing Services
KDLYW,Kindly MD Inc. Warrants,$0.18,-0.01,-5.263%,1070490.00,United States,2024,6000,Health Care,Medical/Nursing Services
KDP,Keurig Dr Pepper Inc. Common Stock,$36.64,-0.28,-0.758%,49687004853.00,United States,,6041401,Consumer Staples,Beverages (Production/Distribution)
KE,Kimball Electronics Inc. Common Stock,$18.54,0.58,3.229%,458556457.00,United States,,125568,Technology,Electrical Products
KELYA,Kelly Services Inc. Class A Common Stock,$20.62,0.30,1.476%,733419295.00,United States,,197173,Consumer Discretionary,Professional Services
KELYB,Kelly Services Inc. Class B Common Stock,$20.60,0.3899,1.929%,732707928.00,United States,,602,Consumer Discretionary,Professional Services
KEN,Kenon Holdings Ltd. Ordinary Shares,$26.60,0.02,0.075%,1403571477.00,Singapore,2015,7316,Utilities,Electric Utilities: Central
KEP,Korea Electric Power Corporation Common Stock,$7.57,0.07,0.933%,9719336126.00,South Korea,1994,68870,Utilities,Electric Utilities: Central
KEQU,Kewaunee Scientific Corporation Common Stock,$32.49,0.36,1.12%,93305042.00,United States,,8320,Industrials,Medical Specialities
KEX,Kirby Corporation Common Stock,$123.88,2.58,2.127%,7172652000.00,United States,,517380,Consumer Discretionary,Marine Transportation
KEY,KeyCorp Common Stock,$17.70,0.21,1.201%,16694564474.00,United States,,11859574,Finance,Major Banks
KEY^I,KeyCorp Depositary Shares Each Representing a 1/40th Ownership Interest in a Share of Fixed-to-Floating Rate Perpetual Non-Cumulative Preferred Stock Series E,$25.66,-0.11,-0.427%,,United States,,31702,,
KEY^J,KeyCorp Depositary Shares each representing a 1/40th ownership interest in a share of Fixed Rate Perpetual Non-Cumulative Preferred Stock Series F,$23.3155,0.1455,0.628%,,United States,,16475,,
KEY^K,KeyCorp Depositary Shares each representing a 1/40th ownership interest in a share of Fixed Rate Perpetual Non-Cumulative Preferred Stock Series G,$23.74,0.09,0.381%,,United States,,12306,,
KEY^L,KeyCorp Depositary Shares each representing a 1/40th ownership interest in a share of Fixed Rate Perpetual Non-Cumulative Preferred Stock Series H,$24.88,0.21,0.851%,,United States,,82465,,
KEYS,Keysight Technologies Inc. Common Stock,$157.25,-0.81,-0.512%,27289692574.00,United States,2014,959735,Industrials,Industrial Machinery/Components
KF,Korea Fund Inc. (The) New Common Stock,$22.53,0.11,0.491%,0.00,United States,,9412,Finance,Investment Managers
KFFB,Kentucky First Federal Bancorp Common Stock,$3.30,0.15,4.762%,26686160.00,United States,2005,3550,Finance,Savings Institutions
KFRC,Kforce Inc. Common Stock,$57.81,0.25,0.434%,1120299990.00,United States,1995,274647,Consumer Discretionary,Professional Services
KFS,Kingsway Financial Services Inc. Common Stock (DE),$8.89,0.15,1.716%,247239105.00,Canada,,53930,Finance,Property-Casualty Insurers
KFY,Korn Ferry Common Stock,$73.38,0.76,1.047%,3816541057.00,United States,1999,220545,Consumer Discretionary,Diversified Commercial Services
KGC,Kinross Gold Corporation Common Stock,$10.03,0.10,1.007%,12326870000.00,Canada,2001,12010963,Basic Materials,Precious Metals
KGEI,Kolibri Global Energy Inc. Common stock,$3.46,0.22,6.79%,123646439.00,United States,,3115,Energy,Oil & Gas Production
KGS,Kodiak Gas Services Inc. Common Stock,$31.39,0.35,1.128%,2652756721.00,United States,2023,632353,Utilities,Natural Gas Distribution
KHC,The Kraft Heinz Company Common Stock,$35.81,0.09,0.252%,43297115302.00,United States,,5025838,Consumer Staples,Packaged Foods
KIDS,OrthoPediatrics Corp. Common Stock,$27.75,0.72,2.664%,671950322.00,United States,2017,161986,Health Care,Medical/Dental Instruments
KIM,Kimco Realty Corporation (HC) Common Stock,$24.35,0.33,1.374%,16414631242.00,United States,,4771597,Real Estate,Real Estate Investment Trusts
KIM^L,Kimco Realty Corporation Class L Depositary Shares each of which represents a one-one thousandth fractional interest in a share of 5.125% Class L Cumulative Redeemable Preferred Stock liquidation preference $25000.00 per share,$23.68,0.11,0.467%,,United States,,4825,,
KIM^M,Kimco Realty Corporation Class M Depositary Shares each of which represents a one-one thousandth fractional interest in a share of 5.25% Class M Cumulative Redeemable Preferred Stock liquidation preference $25000.00 per share,$24.2463,0.0611,0.253%,,United States,,4367,,
KIM^N,Kimco Realty Corporation Depositary Shares each representing 1/1000th interest in a share of 7.25% Class N Cumulative Convertible Perpetual Preferred Stock,$61.39,0.29,0.475%,,United States,,1054,,
KIND,Nextdoor Holdings Inc. Class A Common Stock,$2.61,0.06,2.353%,991560955.00,United States,,548095,Technology,Computer Software: Programming Data Processing
KINS,Kingstone Companies Inc. Common Stock,$9.99,0.17,1.731%,110536583.00,United States,,122935,Finance,Property-Casualty Insurers
KIO,KKR Income Opportunities Fund Common Shares,$14.56,0.02,0.138%,0.00,United States,2013,106720,Finance,Investment Managers
KIRK,Kirkland's Inc. COMMONSTOCK,$1.99,0.0501,2.583%,26092160.00,United States,2002,104572,Consumer Discretionary,Other Specialty Stores
KITT,Nauticus Robotics Inc. Common stock,$1.36,0.03,2.256%,6323497.00,United States,2021,56594,Industrials,Industrial Machinery/Components
KITTW,Nauticus Robotics Inc. Warrant,$0.0132,0.0012,10.00%,61375.00,United States,2021,795,Industrials,Industrial Machinery/Components
KKR,KKR & Co. Inc. Common Stock,$135.67,-0.11,-0.081%,120398968384.00,United States,,2432928,Finance,Investment Managers
KKRS,KKR Group Finance Co. IX LLC 4.625% Subordinated Notes due 2061,$20.795,0.015,0.072%,18454312284.00,United States,2021,9910,,
KLAC,KLA Corporation Common Stock,$682.59,-25.13,-3.551%,91757175767.00,United States,1980,2279640,Technology,Electronic Components
KLC,KinderCare Learning Companies Inc. Common Stock,$28.35,0.07,0.248%,3242278623.00,,2024,960290,Consumer Discretionary,Other Consumer Services
KLG,WK Kellogg Co Common Stock,$17.64,0.14,0.80%,1515301384.00,United States,2023,641124,Consumer Staples,Packaged Foods
KLIC,Kulicke and Soffa Industries Inc. Common Stock,$44.54,0.32,0.724%,2427843242.00,Singapore,,505015,Technology,Semiconductors
KLTO,Klotho Neurosciences Inc. Common Stock,$0.5616,0.0517,10.139%,9676096.00,United States,2022,2047376,Health Care,Biotechnology: Biological Products (No Diagnostic Substances)
KLTOW,Klotho Neurosciences Inc. Warrant,$0.0248,-0.0023,-8.487%,427292.00,United States,2022,8985,Health Care,Biotechnology: Biological Products (No Diagnostic Substances)
KLTR,Kaltura Inc. Common Stock,$1.39,0.05,3.731%,207100189.00,United States,2021,133247,Technology,Computer Software: Prepackaged Software
KLXE,KLX Energy Services Holdings Inc. Common Stock,$5.20,0.00,0.00%,87695041.00,United States,,122784,Energy,Oilfield Services/Equipment
KMB,Kimberly-Clark Corporation Common Stock,$145.94,0.71,0.489%,49153238076.00,United States,,1819271,Consumer Discretionary,Containers/Packaging
KMDA,Kamada Ltd. Ordinary Shares,$5.2454,-0.0246,-0.467%,235203736.00,Israel,2013,22971,Health Care,Biotechnology: Pharmaceutical Preparations
KMI,Kinder Morgan Inc. Common Stock,$24.93,0.17,0.687%,55331202992.00,United States,2011,17540924,Utilities,Natural Gas Distribution
KMPB,Kemper Corporation 5.875% Fixed-Rate Reset Junior Subordinated Debentures due 2062,$23.56,0.12,0.512%,1517892887.00,United States,2022,15291,Finance,Property-Casualty Insurers
KMPR,Kemper Corporation,$62.96,1.66,2.708%,4056304591.00,United States,,273312,Finance,Property-Casualty Insurers
KMT,Kennametal Inc. Common Stock,$26.05,0.71,2.802%,2029315606.00,United States,,788029,Industrials,Industrial Machinery/Components
KMX,CarMax Inc,$74.81,1.14,1.547%,11589889950.00,United States,,1250847,Consumer Discretionary,Retail-Auto Dealers and Gas Stations
KN,Knowles Corporation Common Stock,$17.92,0.20,1.129%,1584616911.00,United States,2014,453568,Consumer Staples,Consumer Electronics/Appliances
KNDI,Kandi Technologies Group Inc. Ordinary Shares,$1.64,0.01,0.613%,143267504.00,China,,130887,Consumer Discretionary,Auto Manufacturing
KNF,Knife Riv Holding Co. Common Stock,$93.16,2.14,2.351%,5274039598.00,United States,2023,365511,Industrials,Mining & Quarrying of Nonmetallic Minerals (No Fuels)
KNOP,KNOT Offshore Partners LP Common Units representing Limited Partner Interests,$6.51,-0.05,-0.762%,221633477.00,United Kingdom,2013,98446,Consumer Discretionary,Marine Transportation
KNSA,Kiniksa Pharmaceuticals International plc Class A Ordinary Shares,$26.32,-0.74,-2.735%,1875134500.00,United States,2018,190656,Health Care,Biotechnology: Pharmaceutical Preparations
KNSL,Kinsale Capital Group Inc. Common Stock,$471.28,5.51,1.183%,10974425431.00,United States,,123273,Finance,Property-Casualty Insurers
KNTK,Kinetik Holdings Inc. Class A Common Stock,$49.76,0.69,1.406%,7838140364.00,United States,2022,740483,Utilities,Natural Gas Distribution
KNW,Know Labs Inc. Common Stock,$0.2099,0.0059,2.892%,22245202.00,,2022,320972,Industrials,Industrial Machinery/Components
KNX,Knight-Swift Transportation Holdings Inc.,$53.41,1.89,3.668%,8645156240.00,United States,2017,3074421,Industrials,Trucking Freight/Courier Services
KO,Coca-Cola Company (The) Common Stock,$70.57,0.23,0.327%,304147395346.00,United States,,7936461,Consumer Staples,Beverages (Production/Distribution)
KOD,Kodiak Sciences Inc Common Stock,$3.00,0.12,4.167%,157844187.00,United States,2018,232510,Health Care,Biotechnology: Biological Products (No Diagnostic Substances)
KODK,Eastman Kodak Company Common New,$4.68,0.05,1.08%,375804000.00,United States,,271754,Consumer Discretionary,Industrial Machinery/Components
KOF,Coca Cola Femsa S.A.B. de C.V.  American Depositary Shares each representing 10 Units (each Unit consists of 3 Series B Shares and 5 Series L Shares),$87.34,0.49,0.564%,18348668959.00,Mexico,1993,125943,Consumer Staples,Beverages (Production/Distribution)
KOP,Koppers Holdings Inc. Common Stock,$37.47,0.56,1.517%,768858021.00,United States,2006,75152,Basic Materials,Forest Products
KOPN,Kopin Corporation Common Stock,$0.785,0.0657,9.134%,94959961.00,United States,1992,1335495,Technology,Semiconductors
KORE,KORE Group Holdings Inc. Common Stock,$2.10,0.00,0.00%,37994846.00,United States,,3068,Telecommunications,Telecommunications Equipment
KOS,Kosmos Energy Ltd. Common Shares (DE),$4.16,0.18,4.523%,1962757351.00,Bermuda,2011,9941339,Energy,Oil & Gas Production
KOSS,Koss Corporation Common Stock,$8.25,0.57,7.422%,76723309.00,United States,,625626,Consumer Staples,Consumer Electronics/Appliances
KPLT,Katapult Holdings Inc. Common Stock,$9.36,0.10,1.08%,39021082.00,United States,2019,6036,Consumer Discretionary,Diversified Commercial Services
KPLTW,Katapult Holdings Inc. Warrant,$0.0057,0.0002,3.636%,23763.00,United States,2019,13711,Consumer Discretionary,Diversified Commercial Services
KPRX,Kiora Pharmaceuticals Inc.  Common Stock,$3.40,0.20,6.25%,10099853.00,United States,,35198,Health Care,Biotechnology: Pharmaceutical Preparations
KPTI,Karyopharm Therapeutics Inc. Common Stock,$0.848,0.0108,1.29%,105731761.00,United States,2013,346772,Health Care,Biotechnology: Pharmaceutical Preparations
KR,Kroger Company (The) Common Stock,$56.65,0.51,0.908%,40985497649.00,United States,,2947921,Consumer Staples,Food Chains
KRC,Kilroy Realty Corporation Common Stock,$41.38,1.26,3.141%,4857400859.00,United States,1997,1131049,Real Estate,Real Estate Investment Trusts
KREF,KKR Real Estate Finance Trust Inc. Common Stock,$12.06,0.19,1.601%,836158488.00,United States,2017,235265,Real Estate,Real Estate Investment Trusts
KREF^A,KKR Real Estate Finance Trust Inc. 6.50% Series A Cumulative Redeemable Preferred Stock,$21.34,0.33,1.571%,,United States,,24451,,
KRG,Kite Realty Group Trust Common Stock,$26.20,0.22,0.847%,5755239742.00,United States,2004,1501690,Real Estate,Real Estate Investment Trusts
KRKR,36Kr Holdings Inc. American Depositary Shares,$4.90,0.4522,10.167%,9556397.00,China,2019,38953,Consumer Discretionary,Business Services
KRMD,KORU Medical Systems Inc. Common Stock (DE),$2.66,0.06,2.308%,121975172.00,United States,,40719,Health Care,Medical/Dental Instruments
KRNT,Kornit Digital Ltd. Ordinary Shares,$24.91,0.37,1.508%,1188696058.00,Israel,2015,208580,Industrials,Industrial Machinery/Components
KRNY,Kearny Financial Corp Common Stock,$7.47,0.28,3.894%,482410232.00,United States,2005,418532,Finance,Savings Institutions
KRO,Kronos Worldwide Inc Common Stock,$12.33,0.31,2.579%,1418397776.00,United States,,179469,Industrials,Major Chemicals
KRON,Kronos Bio Inc. Common Stock,$0.965,0.005,0.521%,58184299.00,United States,2020,21042,Health Care,Biotechnology: Pharmaceutical Preparations
KROS,Keros Therapeutics Inc. Common Stock,$62.18,1.79,2.964%,2333123991.00,United States,2020,584100,Health Care,Biotechnology: Pharmaceutical Preparations
KRP,Kimbell Royalty Partners Common Units Representing Limited Partner Interests,$15.97,0.00,0.00%,1525035523.00,United States,2017,399312,Energy,Oil & Gas Production
KRRO,Korro Bio Inc. Common Stock,$77.00,37.24,93.662%,716008755.00,United States,2019,1509968,Health Care,Biotechnology: Pharmaceutical Preparations
KRT,Karat Packaging Inc. Common Stock,$27.39,0.55,2.049%,548201674.00,United States,2021,20745,Industrials,Plastic Products
KRUS,Kura Sushi USA Inc. Class A Common Stock,$83.79,-0.22,-0.262%,942213774.00,United States,2019,83450,Consumer Discretionary,Restaurants
KRYS,Krystal Biotech Inc. Common Stock,$177.78,-0.68,-0.381%,5107610511.00,United States,2017,107367,Health Care,Biotechnology: Biological Products (No Diagnostic Substances)
KSCP,Knightscope Inc. Class A Common Stock,$7.79,0.66,9.257%,23809496.00,United States,2022,154690,Telecommunications,Telecommunications Equipment
KSM,DWS Strategic Municipal Income Trust,$10.17,0.02,0.197%,0.00,United States,1989,13913,Finance,Trusts Except Educational Religious and Charitable
KSPI,Joint Stock Company Kaspi.kz American Depository Shares,$108.39,3.54,3.376%,20521854271.00,Kazakhstan,2024,217780,,
KSS,Kohl's Corporation Common Stock,$19.80,-0.16,-0.802%,2202521409.00,United States,1992,4662590,Consumer Discretionary,Department/Specialty Retail Stores
KT,KT Corporation Common Stock,$15.70,0.66,4.388%,7737381451.00,South Korea,,879151,Telecommunications,Telecommunications Equipment
KTB,Kontoor Brands Inc. Common Stock ,$83.03,1.21,1.479%,4623547885.00,United States,2019,260155,Consumer Discretionary,Apparel
KTCC,Key Tronic Corporation Common Stock,$5.86,0.14,2.448%,63064564.00,United States,1983,33650,Technology,Electrical Products
KTF,DWS Municipal Income Trust,$10.13,0.05,0.496%,400144502.00,United States,1988,287903,Finance,Finance Companies
KTH,Structures Products Cp 8% CorTS Issued by Peco Energy Cap Tr II Preferred Stock,$29.2201,0.0001,0.00%,0.00,United States,,1061,Finance,Finance: Consumer Services
KTN,Structured Products Corp 8.205% CorTS 8.205% Corporate Backed Trust Securities (CorTS),$27.73,0.21,0.763%,0.00,United States,,32631,Finance,Finance: Consumer Services
KTOS,Kratos Defense & Security Solutions Inc. Common Stock,$25.74,0.44,1.739%,3886721982.00,United States,,866718,Industrials,Military/Government/Technical
KTRA,Kintara Therapeutics Inc. Common Stock,$0.2299,0.0029,1.278%,12796367.00,United States,,5912399,Health Care,Biotechnology: Pharmaceutical Preparations
KTTA,Pasithea Therapeutics Corp. Common Stock,$3.96,0.01,0.253%,4134561.00,United States,2021,9625,Health Care,Biotechnology: Pharmaceutical Preparations
KUKE,Kuke Music Holding Limited American Depositary Shares each representing one Ordinary Share,$0.8607,0.0105,1.235%,28619758.00,,2021,47718,Real Estate,Other Consumer Services
KULR,KULR Technology Group Inc. Common Stock,$0.319,0.0119,3.875%,61563688.00,United States,,2002321,Technology,Electrical Products
KURA,Kura Oncology Inc. Common Stock,$18.27,0.06,0.329%,1400112242.00,United States,,409481,Health Care,Biotechnology: Pharmaceutical Preparations
KVAC,Keen Vision Acquisition Corporation Ordinary Shares,$10.77,0.00,0.00%,0.00,United States,2023,9222,,
KVACU,Keen Vision Acquisition Corporation Units,$10.88,0.005,0.046%,0.00,United States,2023,900,,
KVACW,Keen Vision Acquisition Corporation Warrant,$0.04,0.00,0.00%,0.00,United States,2023,7093,,
KVHI,KVH Industries Inc. Common Stock,$4.86,0.06,1.25%,95810458.00,United States,1996,9194,Technology,Radio And Television Broadcasting And Communications Equipment
KVUE,Kenvue Inc. Common Stock,$21.73,-0.03,-0.138%,41616586646.00,United States,2023,13919544,Consumer Discretionary,Specialty Chemicals
KVYO,Klaviyo Inc. Series A Common Stock,$37.12,-0.30,-0.802%,9898892332.00,United States,2023,568135,Technology,Computer Software: Prepackaged Software
KW,Kennedy-Wilson Holdings Inc. Common Stock,$11.21,0.46,4.279%,1540387657.00,United States,,475856,Finance,Real Estate
KWE,KWESST Micro Systems Inc. Common Stock,$0.1422,-0.0018,-1.25%,2245338.00,Canada,,54195,Technology,Computer Software: Prepackaged Software
KWESW,KWESST Micro Systems Inc. Warrant,$0.01,-0.001,-9.091%,157900.00,Canada,,12864,Technology,Computer Software: Prepackaged Software
KWR,Quaker Houghton Common Stock,$165.63,3.10,1.907%,2966790233.00,United States,,68569,Industrials,Major Chemicals
KXIN,Kaixin Holdings Ordinary Shares,$0.17,0.006,3.659%,10140500.00,China,2017,11486905,Consumer Discretionary,Retail-Auto Dealers and Gas Stations
KYMR,Kymera Therapeutics Inc. Common Stock,$49.02,4.22,9.42%,3027143972.00,United States,2020,371264,Health Care,Biotechnology: Biological Products (No Diagnostic Substances)
KYN,Kayne Anderson Energy Infrastructure Fund Inc.,$11.82,0.08,0.681%,1609074685.00,United States,2004,251079,Finance,Finance/Investors Services
KYTX,Kyverna Therapeutics Inc. Common Stock,$5.53,0.15,2.788%,238602092.00,United States,2024,324160,Health Care,Biotechnology: Biological Products (No Diagnostic Substances)
KZIA,Kazia Therapeutics Limited American Depositary Shares,$0.3334,0.0033,1.00%,9931986.00,Australia,,448443,Health Care,Biotechnology: Pharmaceutical Preparations
KZR,Kezar Life Sciences Inc. Common Stock,$0.8947,0.0247,2.839%,65279298.00,United States,2018,248108,Health Care,Biotechnology: Pharmaceutical Preparations
L,Loews Corporation Common Stock,$80.59,0.26,0.324%,17690835702.00,United States,,908460,Finance,Property-Casualty Insurers
